{
  "$schema": "http://json-schema.org/draft-07/schema#",
  "type": "object",
  "properties": {
    "header": {
      "$ref": "#"
    },
    "contributor": {
      "$ref": "#"
    },
    "paymentDetails": {
      "$ref": "#"
    },
    "treasurySection": {
      "$ref": "#"
    },
    "inpsSection": {
      "$ref": "#"
    },
    "regionSection": {
      "$ref": "#"
    },
    "imuSection": {
      "$ref": "#"
    },
    "exciseSection": {
      "$ref": "#"
    },
    "ibanCode": {
      "type": "string"
    }
  },
  "description": "F24 Excise (Accise) object"
}